{
  "$schema": "../schemas/work-package.schema.json",
  "schema_version": "1.0.0",
  "id": "WP-YYYY-NNNN",
  "title": "Concise delivery outcome",
  "owner": "named accountable owner",
  "demand": "BADF-DEM-0000",
  "repository": "owner/repo",
  "objective": "One measurable delivery outcome",
  "business_value": "Value proposition and KPI",
  "in_scope": [],
  "out_of_scope": [],
  "target_gate": "G00",
  "change_class": "C1",
  "data_classification": "internal",
  "acceptance_criteria": [],
  "permissions": [],
  "tests": [],
  "evidence": [],
  "rollback": {
    "reversible": true,
    "method": "revert the squash commit via PR"
  },
  "status": "DRAFT",
  "external_target": {
    "repository": "owner/repo",
    "branch": "main",
    "base_revision": ""
  }
}
